{
  "id": "ielts-r-0021",
  "slug": "ancient-chinese-chariots",
  "title": "Ancient Chinese Chariots",
  "page_range": [
    119,
    123
  ],
  "passage_text": "Reading Practice\n \nAncient Chinese Chariots\nA The Shang Dynasty or Yin Dynasty, according to traditional historiography, ruled in the\nYellow River valley in the second millennium. Archaeological work at the Ruins of Yin (near\nmodern-day Anyang), which has been identified as the last Shang capital, uncovered\neleven major Yin royal tombs and the foundations of palaces and ritual sites, containing\nweapons of war and remains from both animal and human sacrifices.\nB The Tomb of Fu Hao is an archaeological site at Yinxu, the ruins of the ancient Shang\nDynasty capital Yin, within the modem city of Anyang in Henan Province, China.\nDiscovered in 1976it was identified as the final resting place of the queen and military\ngeneral Fu Hao. The artifacts unearthed within the grave included jade objects, bone\nobjects, bronze objects etc. These grave goods are confirmed by the oracle texts, which\nconstitute almost all of the first hand written record we possess of the Shang Dynasty.\nBelow the corpse was a small pit holding the remains of six sacrificial dogs and along the\nedge lay the skeletons of human slaves, evidence of human sacrifice.\nC The Terracotta Army was discovered on 29 March 1974 to the east of Xian in Shaanxi.\nThe terracotta soldiers were accidentally discovered when a group of local farmers was\ndigging a well during a drought around 1.6 km (1 mile) east of the Qin Emperors tomb\naround at Mount Li (Lishan), a region riddled with underground springs and watercourses.\nExperts currently place the entire number of soldiers at 8,000 — with 130 chariots (130 cm\nlong), 530 horses and 150 cavalry horses helping to ward of any dangers in the afterlife. In\ncontrast, the burial of Tutank Hamun yielded six complete but dismantled chariots of\nunparalleled richness and sophistication. Each was designed for two people (90 cm long)\nand had its axle sawn through to enable it to be brought along the narrow corridor into the\ntomb.\nD Excavation of ancient Chinese chariots has confirmed the descriptions of them in the\nearliest texts. Wheels were constructed from a variety of woods: elm provided the hub,\nrose-wood the spokes and oak the felloes. The hub was drilled through to form an empty\nspace into which the tampering axle was fitted, the whole being covered with leather to\nretain lubricating oil. Though the number of spokes varied, a wheel by the fourth century\nBC usually had eighteen to thirty-two of them. Records show how elaborate was the testing\nof each completed wheel: flotation and weighing were regarded as the best measures of\nbalance, but even the empty spaces in the assembly were checked with millet grains. One\noutstanding constructional asset of the ancient Chinese wheel was dishing. Dishing refers\nto the dish-like shape of an advanced wooden wheel, which looks rather like a flat cone. On\noccasion they chose to strengthen a dished wheel with a pair of struts running from rim to\nrim on each of the hub. As these extra supports were inserted separately into the felloes,\nthey would have added even greater strength to the wheel. Leather wrapped up the edge\nof the wheel aimed to retain bronze.\nE Within a millennium, however, Chinese chariot-makers had developed a vehicle with\nshafts, the precursor of the true carriage or cart. This design did not make its appearance\nin Europe until the end of the Roman Empire. Because the shafts curved upwards, and the\nharness pressed against a horse’s shoulders, not his neck, the shaft chariot was incredibly\nefficient. The halberd was also part of chariot standard weaponry. This halberd usually\nmeasured well over 3 metres in length, which meant that a chariot warrior wielding it\n \n1\n\nsideways could strike down the charioteer in a passing chariot. The speed of chariot which\nwas tested on the sand was quite fast. At speed these passes were very dangerous for the\ncrews of both chariots.\n \nF The advantages offered by the new chariots were not entirely missed. They could see\nhow there were literally the warring states, whose conflicts lasted down the Qin unification\nof China. Qin Shi Huang was buried in the most opulent tomb complex ever constructed in\nChina, a sprawling, city-size collection of underground caverns containing everything the\nemperor would need for the afterlife. Even a collection of terracotta armies called Terra-\nCotta Warriors was buried in it. The ancient Chinese, along with many cultures including\nancient Egyptians, believed that items and even people buried with a person could be\ntaken with him to the afterlife.\n \n2",
  "questions_text": "Questions 1-4\nDo the following statements agree with the information given in Reading Passage?\nIn boxes 1-4 on you answer sheet, write\nTRUE\nFALSE\nNOT GIVEN\nif the statement is true\nif the statement is false\nif the information is not given in the passage\n \n \n \n \n1..................... When discovered, the written records of the grave goods proved to be\naccurate.\n2..................... Human skeletons in Anyang tomb were identified as soldiers who were\nkilled in the war.\n3..................... The Terracotta Army was discovered by people lived nearby by chance.\n4..................... The size of the King Tutankhamen’s tomb is bigger than that of in Qin\nEmperors’ tomb.\n \n \n \n \n \nQuestions 5-10\nComplete the notes below.\nChoose ONE WORD from the passage for each answer.\nWrite your answers in boxes 5-10 on your answer sheet.\n \n \n \n \n5. The hub is made of wood from the tree of 5.....................\n6. The room through the hub was to put tempering axle in which is wrapped up by\nleather aiming to retain 6.....................\n7. The number of spokes varied from 18 to 7......................\n8. The shape of wheel resembles a 8.....................\n9. Two was used to strengthen the wheel 9......................\n10. Leather wrapped up the edge of the wheel aimed to remain 10......................\nQuestions 11-13\nAnswer the questions below.\nChoose NO MORE THAN THREE WORDS AND/OR A NUMBER from the passage for\neach answer.\n11. What body part of horse was released the pressure from to the shoulder?\n11.....................\n \n3\n\n \n12. what kind road surface did the researchers measure the speed of the chariot?\n12.....................\n13. What part of his afterlife palace was the Emperor Qin Shi Huang buried?\n13.....................\n \n4",
  "full_text": "Reading Practice\n \nAncient Chinese Chariots\nA The Shang Dynasty or Yin Dynasty, according to traditional historiography, ruled in the\nYellow River valley in the second millennium. Archaeological work at the Ruins of Yin (near\nmodern-day Anyang), which has been identified as the last Shang capital, uncovered\neleven major Yin royal tombs and the foundations of palaces and ritual sites, containing\nweapons of war and remains from both animal and human sacrifices.\nB The Tomb of Fu Hao is an archaeological site at Yinxu, the ruins of the ancient Shang\nDynasty capital Yin, within the modem city of Anyang in Henan Province, China.\nDiscovered in 1976it was identified as the final resting place of the queen and military\ngeneral Fu Hao. The artifacts unearthed within the grave included jade objects, bone\nobjects, bronze objects etc. These grave goods are confirmed by the oracle texts, which\nconstitute almost all of the first hand written record we possess of the Shang Dynasty.\nBelow the corpse was a small pit holding the remains of six sacrificial dogs and along the\nedge lay the skeletons of human slaves, evidence of human sacrifice.\nC The Terracotta Army was discovered on 29 March 1974 to the east of Xian in Shaanxi.\nThe terracotta soldiers were accidentally discovered when a group of local farmers was\ndigging a well during a drought around 1.6 km (1 mile) east of the Qin Emperors tomb\naround at Mount Li (Lishan), a region riddled with underground springs and watercourses.\nExperts currently place the entire number of soldiers at 8,000 — with 130 chariots (130 cm\nlong), 530 horses and 150 cavalry horses helping to ward of any dangers in the afterlife. In\ncontrast, the burial of Tutank Hamun yielded six complete but dismantled chariots of\nunparalleled richness and sophistication. Each was designed for two people (90 cm long)\nand had its axle sawn through to enable it to be brought along the narrow corridor into the\ntomb.\nD Excavation of ancient Chinese chariots has confirmed the descriptions of them in the\nearliest texts. Wheels were constructed from a variety of woods: elm provided the hub,\nrose-wood the spokes and oak the felloes. The hub was drilled through to form an empty\nspace into which the tampering axle was fitted, the whole being covered with leather to\nretain lubricating oil. Though the number of spokes varied, a wheel by the fourth century\nBC usually had eighteen to thirty-two of them. Records show how elaborate was the testing\nof each completed wheel: flotation and weighing were regarded as the best measures of\nbalance, but even the empty spaces in the assembly were checked with millet grains. One\noutstanding constructional asset of the ancient Chinese wheel was dishing. Dishing refers\nto the dish-like shape of an advanced wooden wheel, which looks rather like a flat cone. On\noccasion they chose to strengthen a dished wheel with a pair of struts running from rim to\nrim on each of the hub. As these extra supports were inserted separately into the felloes,\nthey would have added even greater strength to the wheel. Leather wrapped up the edge\nof the wheel aimed to retain bronze.\nE Within a millennium, however, Chinese chariot-makers had developed a vehicle with\nshafts, the precursor of the true carriage or cart. This design did not make its appearance\nin Europe until the end of the Roman Empire. Because the shafts curved upwards, and the\nharness pressed against a horse’s shoulders, not his neck, the shaft chariot was incredibly\nefficient. The halberd was also part of chariot standard weaponry. This halberd usually\nmeasured well over 3 metres in length, which meant that a chariot warrior wielding it\n \n1\n\nsideways could strike down the charioteer in a passing chariot. The speed of chariot which\nwas tested on the sand was quite fast. At speed these passes were very dangerous for the\ncrews of both chariots.\n \nF The advantages offered by the new chariots were not entirely missed. They could see\nhow there were literally the warring states, whose conflicts lasted down the Qin unification\nof China. Qin Shi Huang was buried in the most opulent tomb complex ever constructed in\nChina, a sprawling, city-size collection of underground caverns containing everything the\nemperor would need for the afterlife. Even a collection of terracotta armies called Terra-\nCotta Warriors was buried in it. The ancient Chinese, along with many cultures including\nancient Egyptians, believed that items and even people buried with a person could be\ntaken with him to the afterlife.\n \n2\n\nQuestions 1-4\nDo the following statements agree with the information given in Reading Passage?\nIn boxes 1-4 on you answer sheet, write\nTRUE\nFALSE\nNOT GIVEN\nif the statement is true\nif the statement is false\nif the information is not given in the passage\n \n \n \n \n1..................... When discovered, the written records of the grave goods proved to be\naccurate.\n2..................... Human skeletons in Anyang tomb were identified as soldiers who were\nkilled in the war.\n3..................... The Terracotta Army was discovered by people lived nearby by chance.\n4..................... The size of the King Tutankhamen’s tomb is bigger than that of in Qin\nEmperors’ tomb.\n \n \n \n \n \nQuestions 5-10\nComplete the notes below.\nChoose ONE WORD from the passage for each answer.\nWrite your answers in boxes 5-10 on your answer sheet.\n \n \n \n \n5. The hub is made of wood from the tree of 5.....................\n6. The room through the hub was to put tempering axle in which is wrapped up by\nleather aiming to retain 6.....................\n7. The number of spokes varied from 18 to 7......................\n8. The shape of wheel resembles a 8.....................\n9. Two was used to strengthen the wheel 9......................\n10. Leather wrapped up the edge of the wheel aimed to remain 10......................\nQuestions 11-13\nAnswer the questions below.\nChoose NO MORE THAN THREE WORDS AND/OR A NUMBER from the passage for\neach answer.\n11. What body part of horse was released the pressure from to the shoulder?\n11.....................\n \n3\n\n \n12. what kind road surface did the researchers measure the speed of the chariot?\n12.....................\n13. What part of his afterlife palace was the Emperor Qin Shi Huang buried?\n13.....................\n \n4",
  "solution_text": "Solution:\n\n 1. TRUE             8. dish\n\n 2. FALSE            9. struts\n\n 3. TRUE            10. bronze\n\n 4. NOT GIVEN      11. Neck\n\n 5. elm              12. Sand\n\n 6. oil                13. Tomb complex\n\n 7. 32\n\n\n\n\n\n                                                                  5",
  "answer_key": {
    "1": "TRUE",
    "8": "dish",
    "2": "FALSE",
    "9": "struts",
    "3": "TRUE",
    "10": "bronze",
    "4": "NOT GIVEN",
    "11": "Neck",
    "5": "elm",
    "12": "Sand",
    "6": "oil",
    "13": "Tomb complex",
    "7": "32"
  },
  "question_sections": [
    {
      "label": "Questions 1-4",
      "page": 121
    },
    {
      "label": "Questions 5-10",
      "page": 121
    },
    {
      "label": "Questions 11-13",
      "page": 121
    }
  ],
  "extracted_at": "2026-02-25T17:36:59.043013"
}