{
  "id": "ielts-r-0443",
  "slug": "the-burgess-shale-fossils",
  "title": "The Burgess Shale fossils",
  "page_range": [
    2246,
    2250
  ],
  "passage_text": "Reading Practice\n \nThe Burgess Shale fossils\n Fauna vanished with a whimper, not a bang\n \nSome discoveries are so unusual it takes decades and sometimes even centuries to\nunderstand their full significance. One such discovery is the fossil bed known as the ago. It\nwas discovered in the Canadian Rockies over a century ago and was popularised in 1989\nin a book, Wonderful Life, by Stephen Jay Gould an American palaeontologist.\nThe Burgess Shale fossils were created at a time when the future Canadian land mass was\nsituated near the Earth’s equator. The creatures were preserved when an entire marine\necosystem was buried in mud that eventually hardened and became exposed hundreds of\nmillions of years later in an outcrop of the Rocky Mountains. American palaeontologist\nCharles Walcott, following reports of fabulous fossils finds by construction workers on\nCanadian railways who were digging in the mountains in the late 19th century, is said to\nhave tripped over a block of shale in 1909 that revealed the area’s remarkable supply of\nspecimens. It has long been believed that the curious fauna that lived there vanished in a\nseries of extinction because the fossil record ends abruptly, but that no longer appears to\nbe the case. \n \n The Burgess Shale began to form soon after a period of time known as the Cambrian\nexplosion, when most major groups of complex animals arose over a surprisingly short\nperiod. Before 560m years ago, most living things were either individual cells or simple\ncolonies of cells. Then, and for reasons that remain a mystery, life massively diversified\nand became ever more complex as the rate of evolution increased. An unusual feature of\nthe Burgess Shale is that it is one of the earliest fossil beds to contain impressions of the\nsoft body parts alongside the remains of bones and shells, which is highly unusual.\n \nAlthough the fossil bed was discovered on a mountain, these animals originally existed\nbelow an ocean, the bed of which was later pushed up to create the Rockies. Nobody\nknows exactly why they were so well preserved. One possibility is that the creatures were\nburied quickly and in conditions that were hostile to the bacteria that cause decomposition\nof soft body parts.\n \nThose that first worked on the Burgess Shale, unearthing 65,000 specimens over a 14-year\nperiod up to 1924, assumed that the fossils came from extinct members of groups of\nanimals in existence today. This turned out to be misleading because many of the\ncreatures are so unusual that they are still difficult to classify.\nOne such example is Opabinia, a creature that grew to about 8cm (3 inches), had five\neyes, a body that was a series of lobes, a tail in the shape of a fan and that ate using a\nlong proboscis. The proboscis had a set of grasping claws on the end, with which it\ngrabbed food and stuff it into its mouth. Nectocaris, meanwhile, could be mistaken for a\n \n1\n\n \nleech, with fins and tentacles. Weirdest of all was Hallucigenia, described by\npalaeontologist Simon Conway Morris when he re-examined Walcott’s specimens in 1979.\nWith its multiplicity of spines and tentacles, little about Hallucigenia made sense. Like an\nabstract painting, its orientation is a mystery at first, making it difficult to work out which\nway up it went, which hole food went into, and which hole food come out of.\n \nPalaeontologists had long thought that many of the Burgess Shale animals were examples\nof experiments in evolution. In other words, entirely new forms of life that did not survive or\nlead to other groups or species. Hallucigenia, ironically, turned out to be the exception that\nproved the rule. It is now thought to be an ancestor of the modern group of arthropods,\nwhich includes everything from flies and butterflies to centipedes and crabs.\nNow another misconception has been quashed. Writing in Nature, Peter Van Roy of Yale\nUniversity and his colleagues suggest that the sudden absence of such crazy soft-bodied\nfossils does not indicate a mass extinction, but merely an end to the unusual local\ncircumstances that caused the creatures to be preserved. In an area of the Atlas Mountains\nof Morocco, Van Roy’s team of researchers have found another diverse (and sometimes\nbizarre) assemblage of soft-bodied organisms from a period after the Burgess Shale was\nformed. One discovery includes something that may be a stalked barnacle. This suggests\nthat the evolution of such complex life went on uninterrupted. For its part, the Burgess\nShale continues to produce an astonishing array of indefinable creatures faster than\npalaeontologists can examine them. The world still has plenty to learn about this wonderful\nlife.\n \n2\n\n \nQUESTIONS 1 - 5\nDo the following statements agree with the information given in Reading Passage 1?\nIn boxes 1-5 on your answer sheet, write\nTRUE                   if the statement agrees with the information\nFALSE                  if the statement contradicts the information\nNOT GIVEN         there is no information on this \n1..................... The Burgess Shale became widely known to the public because of Gould’s\nbook.\n \n2..................... Charles Walcott had to get permission from Canadian authorities to gain\naccess to the fossil site.\n \n3..................... The Burgess Shale includes impressions of soft and hard body parts.\n \n4..................... The Burgess Shale creatures were land animals.\n5..................... Researchers now believe that Hallucigenia is unrelated to any modern\ncreature.\n \n                                             \nQUESTIONS 6 - 9\nComplete the notes below.\nChoose NO MORE THAN TWO WORDS AND/OR A NUMBER from the passage for each\nanswer.\nWrite your answers in boxes 6-9 on your answer sheet.\n \n \n \n \nBurgess Shale\n-\n-\n-\nQUESTIONS 10 -13\nComplete the table below.\n \n3\n\n \n                                             \nChoose ONE WORD ONLY from the passage for each answer.\nWrite your answers in boxes 10-13 on your answer sheet.\n \n \n \n \nBurgess Shale Creatures\n-\n-\n-\n \n4",
  "questions_text": "",
  "full_text": "Reading Practice\n \nThe Burgess Shale fossils\n Fauna vanished with a whimper, not a bang\n \nSome discoveries are so unusual it takes decades and sometimes even centuries to\nunderstand their full significance. One such discovery is the fossil bed known as the ago. It\nwas discovered in the Canadian Rockies over a century ago and was popularised in 1989\nin a book, Wonderful Life, by Stephen Jay Gould an American palaeontologist.\nThe Burgess Shale fossils were created at a time when the future Canadian land mass was\nsituated near the Earth’s equator. The creatures were preserved when an entire marine\necosystem was buried in mud that eventually hardened and became exposed hundreds of\nmillions of years later in an outcrop of the Rocky Mountains. American palaeontologist\nCharles Walcott, following reports of fabulous fossils finds by construction workers on\nCanadian railways who were digging in the mountains in the late 19th century, is said to\nhave tripped over a block of shale in 1909 that revealed the area’s remarkable supply of\nspecimens. It has long been believed that the curious fauna that lived there vanished in a\nseries of extinction because the fossil record ends abruptly, but that no longer appears to\nbe the case. \n \n The Burgess Shale began to form soon after a period of time known as the Cambrian\nexplosion, when most major groups of complex animals arose over a surprisingly short\nperiod. Before 560m years ago, most living things were either individual cells or simple\ncolonies of cells. Then, and for reasons that remain a mystery, life massively diversified\nand became ever more complex as the rate of evolution increased. An unusual feature of\nthe Burgess Shale is that it is one of the earliest fossil beds to contain impressions of the\nsoft body parts alongside the remains of bones and shells, which is highly unusual.\n \nAlthough the fossil bed was discovered on a mountain, these animals originally existed\nbelow an ocean, the bed of which was later pushed up to create the Rockies. Nobody\nknows exactly why they were so well preserved. One possibility is that the creatures were\nburied quickly and in conditions that were hostile to the bacteria that cause decomposition\nof soft body parts.\n \nThose that first worked on the Burgess Shale, unearthing 65,000 specimens over a 14-year\nperiod up to 1924, assumed that the fossils came from extinct members of groups of\nanimals in existence today. This turned out to be misleading because many of the\ncreatures are so unusual that they are still difficult to classify.\nOne such example is Opabinia, a creature that grew to about 8cm (3 inches), had five\neyes, a body that was a series of lobes, a tail in the shape of a fan and that ate using a\nlong proboscis. The proboscis had a set of grasping claws on the end, with which it\ngrabbed food and stuff it into its mouth. Nectocaris, meanwhile, could be mistaken for a\n \n1\n\n \nleech, with fins and tentacles. Weirdest of all was Hallucigenia, described by\npalaeontologist Simon Conway Morris when he re-examined Walcott’s specimens in 1979.\nWith its multiplicity of spines and tentacles, little about Hallucigenia made sense. Like an\nabstract painting, its orientation is a mystery at first, making it difficult to work out which\nway up it went, which hole food went into, and which hole food come out of.\n \nPalaeontologists had long thought that many of the Burgess Shale animals were examples\nof experiments in evolution. In other words, entirely new forms of life that did not survive or\nlead to other groups or species. Hallucigenia, ironically, turned out to be the exception that\nproved the rule. It is now thought to be an ancestor of the modern group of arthropods,\nwhich includes everything from flies and butterflies to centipedes and crabs.\nNow another misconception has been quashed. Writing in Nature, Peter Van Roy of Yale\nUniversity and his colleagues suggest that the sudden absence of such crazy soft-bodied\nfossils does not indicate a mass extinction, but merely an end to the unusual local\ncircumstances that caused the creatures to be preserved. In an area of the Atlas Mountains\nof Morocco, Van Roy’s team of researchers have found another diverse (and sometimes\nbizarre) assemblage of soft-bodied organisms from a period after the Burgess Shale was\nformed. One discovery includes something that may be a stalked barnacle. This suggests\nthat the evolution of such complex life went on uninterrupted. For its part, the Burgess\nShale continues to produce an astonishing array of indefinable creatures faster than\npalaeontologists can examine them. The world still has plenty to learn about this wonderful\nlife.\n \n2\n\n \nQUESTIONS 1 - 5\nDo the following statements agree with the information given in Reading Passage 1?\nIn boxes 1-5 on your answer sheet, write\nTRUE                   if the statement agrees with the information\nFALSE                  if the statement contradicts the information\nNOT GIVEN         there is no information on this \n1..................... The Burgess Shale became widely known to the public because of Gould’s\nbook.\n \n2..................... Charles Walcott had to get permission from Canadian authorities to gain\naccess to the fossil site.\n \n3..................... The Burgess Shale includes impressions of soft and hard body parts.\n \n4..................... The Burgess Shale creatures were land animals.\n5..................... Researchers now believe that Hallucigenia is unrelated to any modern\ncreature.\n \n                                             \nQUESTIONS 6 - 9\nComplete the notes below.\nChoose NO MORE THAN TWO WORDS AND/OR A NUMBER from the passage for each\nanswer.\nWrite your answers in boxes 6-9 on your answer sheet.\n \n \n \n \nBurgess Shale\n-\n-\n-\nQUESTIONS 10 -13\nComplete the table below.\n \n3\n\n \n                                             \nChoose ONE WORD ONLY from the passage for each answer.\nWrite your answers in boxes 10-13 on your answer sheet.\n \n \n \n \nBurgess Shale Creatures\n-\n-\n-\n \n4",
  "solution_text": "Solution:\n\n 1. TRUE               8. 1979\n\n 2. NOT GIVEN        9. EVOLUTION\n\n 3. TRUE             10. FAN\n\n 4. FALSE            11. FOOD\n\n 5. FALSE            12. LEECH\n\n 6. CAMBRIAN\n                       13. MOVE\n EXPLOSION\n\n 7. RAILWAY\n\n\n\n\n\n                                                                  5",
  "answer_key": {
    "1": "TRUE",
    "8": "1979",
    "2": "NOT GIVEN",
    "9": "EVOLUTION",
    "3": "TRUE",
    "10": "FAN",
    "4": "FALSE",
    "11": "FOOD",
    "5": "FALSE",
    "12": "LEECH",
    "6": "CAMBRIAN",
    "13": "MOVE EXPLOSION",
    "7": "RAILWAY"
  },
  "question_sections": [],
  "extracted_at": "2026-02-25T17:37:02.088972"
}