{
  "id": "ielts-r-0404",
  "slug": "spider-silk-2",
  "title": "Spider silk 2",
  "page_range": [
    2056,
    2060
  ],
  "passage_text": "Reading Practice\n \nSpider silk 2\n \nA strong, light bio-material made by genes from spiders could transform construction and\nindustry\nA\nScientists have succeeded in copying the silk-producing genes of the Golden Orb Weaver\nspider and are using them to create a synthetic material which they believe is the model for\na new generation of advanced bio-materials. The new material, biosilk, which has been\nspun for the first time by researchers at DuPont, has an enormous range of potential uses\nin construction and manufacturing.\nB\nThe attraction of the silk spun by the spider is a combination of great strength and\nenormous elasticity, which man-made fibres have been unable to replicate. On an equal-\nweight basis, spider silk is far stronger than steel and it is estimated that if a single strand\ncould be made about 10m in diameter, it would be strong enough to stop a jumbo jet in\nflight. A third important factor is that it is extremely light. Army scientists are already looking\nat the possibilities of using it for lightweight, bulletproof vests and parachutes.\nC\nFor some time, biochemists have been trying to synthesise the drag-line silk of the Golden\nOrb Weaver. The drag-line silk, which forms the radial arms of the web, is stronger than the\nother parts of the web and some biochemists believe a synthetic version could prove to be\nas important a material as nylon, which has been around for 50 years, since the\ndiscoveries of Wallace Carothers and his team ushered in the age of polymers.\nD\nTo recreate the material, scientists, including Randolph Lewis at the University of\nWyoming, first examined the silk-producing gland of the spider. ‘We took out the glands\nthat produce the silk and looked at the coding for the protein material they make, which is\nspun into a web. We then went looking for clones with the right DNA,’ he says.\nE\nAt DuPont, researchers have used both yeast and bacteria as hosts to grow the raw\nmaterial, which they have spun into fibres. Robert Dorsch, DuPont’s director of biochemical\ndevelopment, says the globules of protein, comparable with marbles in an egg, are\nharvested and processed. ‘We break open the bacteria, separate out the globules of\nprotein and use them as the raw starting material. With yeast, the gene system can be\ndesigned so that the material excretes the protein outside the yeast for better access,’ he\nsays.\nF\n‘The bacteria and the yeast produce the same protein, equivalent to that which the spider\nuses in the draglines of the web. The spider mixes the protein into a water-based solution\n \n1\n\nand then spins it into a solid fibre in one go. Since we are not as clever as the spider and\nwe are not using such sophisticated organisms, we substituted man-made approaches and\ndissolved the protein in chemical solvents, which are then spun to push the material\nthrough small holes to form the solid fibre.’\nG\nResearchers at DuPont say they envisage many possible uses for a new biosilk material.\nThey say that earthquake-resistant suspension bridges hung from cables of synthetic\nspider silk fibres may become a reality. Stronger ropes, safer seat belts, shoe soles that do\nnot wear out so quickly and tough new clothing are among the other applications.\nBiochemists such as Lewis see the potential range of uses of biosilk as almost limitless. ‘It\nis very strong and retains elasticity: there are no man-made materials that can mimic both\nthese properties. It is also a biological material with all the advantages that have over\npetrochemicals,’ he says.\nH\nAt DuPont’s laboratories, Dorsch is excited by the prospect of new super-strong materials\nbut he warns they are many years away. ‘We are at an early stage but theoretical\npredictions are that we will wind up with a very strong, tough material, with an ability to\nabsorb shock, which is stronger and tougher than the man-made materials that are\nconventionally available to us,’ he says.\nI\nThe spider is not the only creature that has aroused the interest of material scientists. They\nhave also become envious of the natural adhesive secreted by the sea mussel. It produces\na protein adhesive to attach itself to rocks. It is tedious and expensive to extract the protein\nfrom the mussel, so researchers have already produced a synthetic gene for use in\nsurrogate bacteria.\n \n2",
  "questions_text": "Questions 1-5\nReading Passage 1 has nine paragraphs, A-I\nWhich paragraph contains the following information?\nWrite the correct letter, A-I, in boxes 1-5 on your answer sheet.\n1.....................   a comparison of the ways two materials are used to replace silk-producing\nglands \n2.....................   predictions regarding the availability of the synthetic silk\n3.....................   ongoing research into other synthetic materials\n4.....................   the research into the part of the spider that manufactures silk\n5.....................   the possible application of the silk in civil engineering\nQuestions 6-10\nComplete the flow-chart below.\nChoose NO MORE THAN TWO WORDS from the passage for each answer.\nWrite your answers in boxes 6-10 on your answer sheet.\nSynthetic gene grown in 6..................... or 7.....................\nglobules of 8......................\ndissolved in 9.....................\npassed through 10.....................\nto produce a solid fibre\nQuestions 11-13\nDo the following statements agree with the information given in Reading Passage?\nIn boxes 11-13 on your answer sheet, write\nTRUE               if the statement is true\n \n3\n\n \n \n \n \nFALSE              if the statement is false\nNOT GIVEN    if the information is not given in the passage\n11.....................   Biosilk has already replaced nylon in parachute manufacture.\n12.....................   The spider produces silk of varying strengths.\n13.....................   Lewis and Dorsch co-operated in the synthetic production of silk.\n \n4",
  "full_text": "Reading Practice\n \nSpider silk 2\n \nA strong, light bio-material made by genes from spiders could transform construction and\nindustry\nA\nScientists have succeeded in copying the silk-producing genes of the Golden Orb Weaver\nspider and are using them to create a synthetic material which they believe is the model for\na new generation of advanced bio-materials. The new material, biosilk, which has been\nspun for the first time by researchers at DuPont, has an enormous range of potential uses\nin construction and manufacturing.\nB\nThe attraction of the silk spun by the spider is a combination of great strength and\nenormous elasticity, which man-made fibres have been unable to replicate. On an equal-\nweight basis, spider silk is far stronger than steel and it is estimated that if a single strand\ncould be made about 10m in diameter, it would be strong enough to stop a jumbo jet in\nflight. A third important factor is that it is extremely light. Army scientists are already looking\nat the possibilities of using it for lightweight, bulletproof vests and parachutes.\nC\nFor some time, biochemists have been trying to synthesise the drag-line silk of the Golden\nOrb Weaver. The drag-line silk, which forms the radial arms of the web, is stronger than the\nother parts of the web and some biochemists believe a synthetic version could prove to be\nas important a material as nylon, which has been around for 50 years, since the\ndiscoveries of Wallace Carothers and his team ushered in the age of polymers.\nD\nTo recreate the material, scientists, including Randolph Lewis at the University of\nWyoming, first examined the silk-producing gland of the spider. ‘We took out the glands\nthat produce the silk and looked at the coding for the protein material they make, which is\nspun into a web. We then went looking for clones with the right DNA,’ he says.\nE\nAt DuPont, researchers have used both yeast and bacteria as hosts to grow the raw\nmaterial, which they have spun into fibres. Robert Dorsch, DuPont’s director of biochemical\ndevelopment, says the globules of protein, comparable with marbles in an egg, are\nharvested and processed. ‘We break open the bacteria, separate out the globules of\nprotein and use them as the raw starting material. With yeast, the gene system can be\ndesigned so that the material excretes the protein outside the yeast for better access,’ he\nsays.\nF\n‘The bacteria and the yeast produce the same protein, equivalent to that which the spider\nuses in the draglines of the web. The spider mixes the protein into a water-based solution\n \n1\n\nand then spins it into a solid fibre in one go. Since we are not as clever as the spider and\nwe are not using such sophisticated organisms, we substituted man-made approaches and\ndissolved the protein in chemical solvents, which are then spun to push the material\nthrough small holes to form the solid fibre.’\nG\nResearchers at DuPont say they envisage many possible uses for a new biosilk material.\nThey say that earthquake-resistant suspension bridges hung from cables of synthetic\nspider silk fibres may become a reality. Stronger ropes, safer seat belts, shoe soles that do\nnot wear out so quickly and tough new clothing are among the other applications.\nBiochemists such as Lewis see the potential range of uses of biosilk as almost limitless. ‘It\nis very strong and retains elasticity: there are no man-made materials that can mimic both\nthese properties. It is also a biological material with all the advantages that have over\npetrochemicals,’ he says.\nH\nAt DuPont’s laboratories, Dorsch is excited by the prospect of new super-strong materials\nbut he warns they are many years away. ‘We are at an early stage but theoretical\npredictions are that we will wind up with a very strong, tough material, with an ability to\nabsorb shock, which is stronger and tougher than the man-made materials that are\nconventionally available to us,’ he says.\nI\nThe spider is not the only creature that has aroused the interest of material scientists. They\nhave also become envious of the natural adhesive secreted by the sea mussel. It produces\na protein adhesive to attach itself to rocks. It is tedious and expensive to extract the protein\nfrom the mussel, so researchers have already produced a synthetic gene for use in\nsurrogate bacteria.\n \n2\n\nQuestions 1-5\nReading Passage 1 has nine paragraphs, A-I\nWhich paragraph contains the following information?\nWrite the correct letter, A-I, in boxes 1-5 on your answer sheet.\n1.....................   a comparison of the ways two materials are used to replace silk-producing\nglands \n2.....................   predictions regarding the availability of the synthetic silk\n3.....................   ongoing research into other synthetic materials\n4.....................   the research into the part of the spider that manufactures silk\n5.....................   the possible application of the silk in civil engineering\nQuestions 6-10\nComplete the flow-chart below.\nChoose NO MORE THAN TWO WORDS from the passage for each answer.\nWrite your answers in boxes 6-10 on your answer sheet.\nSynthetic gene grown in 6..................... or 7.....................\nglobules of 8......................\ndissolved in 9.....................\npassed through 10.....................\nto produce a solid fibre\nQuestions 11-13\nDo the following statements agree with the information given in Reading Passage?\nIn boxes 11-13 on your answer sheet, write\nTRUE               if the statement is true\n \n3\n\n \n \n \n \nFALSE              if the statement is false\nNOT GIVEN    if the information is not given in the passage\n11.....................   Biosilk has already replaced nylon in parachute manufacture.\n12.....................   The spider produces silk of varying strengths.\n13.....................   Lewis and Dorsch co-operated in the synthetic production of silk.\n \n4",
  "solution_text": "Solution:\n\n 1. E                   8. protein\n\n 2. H                   9. chemical\n\n 3. I                  10. holes\n\n 4. D                 11. FALSE\n\n 5. G                 12. TRUE\n\n 6. yeast             13. NOT GIVEN\n\n 7. bacteria\n\n\n\n\n\n                                                                  5",
  "answer_key": {
    "1": "E",
    "8": "protein",
    "2": "H",
    "9": "chemical",
    "3": "I",
    "10": "holes",
    "4": "D",
    "11": "FALSE",
    "5": "G",
    "12": "TRUE",
    "6": "yeast",
    "13": "NOT GIVEN",
    "7": "bacteria"
  },
  "question_sections": [
    {
      "label": "Questions 1-5",
      "page": 2058
    },
    {
      "label": "Questions 6-10",
      "page": 2058
    },
    {
      "label": "Questions 11-13",
      "page": 2058
    }
  ],
  "extracted_at": "2026-02-25T17:37:01.860818"
}